{
  "$schema": "./schema.json",
  "baseurl": "https://www.royalroad.com",
  "topRated":{
    "queryString": "/fictions/best-rated?page={{pageNumber}}",
    "startPage": 1
  },
  "overviewSelector": {
    "book": ".fiction-list-item.row",
    "bookTitle": ".fiction-title",
    "bookUri": "a[href]",
    "bookImageUri": "img[src]"
  },
  "bookSelector": {
    "title": ".fic-title h1",
    "author": ".fic-title h4 a",
    "description": ".description",
    "imageUri": "img.thumbnail[src]",
    "chapterTitle": "a",
    "chapter": ".chapter-row",
    "chapterDate": "time",
    "chapterUri": "a"
  }
}
